{"schema":"fleet.commander-message.v1","message_id":"msg_0123456789abcdef","delegation_id":"dlg_0123456789abcdef","fleet_id":"flt_0123456789abcdef","ship_id":"shp_0123456789abcdef","connection_generation":1,"direction":"fleet_to_ship","sequence":1,"ack":0,"expires_at":"2026-07-14T19:22:42.123Z","body":{"type":"delegation.offer.v1","envelope":{"schema":"fleet.delegation-envelope.v1","delegation_id":"dlg_0123456789abcdef","issuer_key_id":"cmdkey_0123456789ab","fleet_id":"flt_0123456789abcdef","ship_id":"shp_0123456789abcdef","voyage_plan_hash":"aaaaaaaaaaaaaaaaaaaaaaaaaaaaaaaaaaaaaaaaaaaaaaaaaaaaaaaaaaaaaaaa","task_contract_hash":"bbbbbbbbbbbbbbbbbbbbbbbbbbbbbbbbbbbbbbbbbbbbbbbbbbbbbbbbbbbbbbbb","state_hash":"cccccccccccccccccccccccccccccccccccccccccccccccccccccccccccccccc","task_id":"verify-host-evidence","blocker_fingerprint":"dddddddddddddddddddddddddddddddddddddddddddddddddddddddddddddddd","mode":"read_only_recovery_assessment","assessment_budget":1,"response_schema":"recovery.response.v1","references":[{"kind":"recovery_evidence_ref","digest":"eeeeeeeeeeeeeeeeeeeeeeeeeeeeeeeeeeeeeeeeeeeeeeeeeeeeeeeeeeeeeeee"}],"issued_at":"2026-07-14T19:12:42.123Z","expires_at":"2026-07-14T19:22:42.123Z","signature":"KhVuZZMe87j39itd0_CT8zXfzyOY8FMTj7E_hB0DzjMY2s-C1totb236lL0g-6ZzUT4RoNERRASzOQLfzOEIAw"}}}
